<?xml version="1.0" encoding="UTF-8"?>
<LoaiMons
    xmlns:xsi="http://www.w3.org/2001/XMLSchema-instance"
   xsi:noNamespaceSchemaLocation="LoaiMons.xsd"
>
    <LoaiMon>
        <loai_id>L01</loai_id>
        <tenLoaiMon>Cà phê</tenLoaiMon>
    </LoaiMon>
    <LoaiMon>
        <loai_id>L02</loai_id>
        <tenLoaiMon>Trà sữa</tenLoaiMon>
    </LoaiMon>
    <LoaiMon>
        <loai_id>L03</loai_id>
        <tenLoaiMon>Sinh tố</tenLoaiMon>
    </LoaiMon>
    <LoaiMon>
        <loai_id>L04</loai_id>
        <tenLoaiMon>Nước ép</tenLoaiMon>
    </LoaiMon>
    <LoaiMon>
        <loai_id>L05</loai_id>
        <tenLoaiMon>Bánh ngọt</tenLoaiMon>
    </LoaiMon>
    <LoaiMon>
        <loai_id>L06</loai_id>
        <tenLoaiMon>Topping</tenLoaiMon>
    </LoaiMon>
    <LoaiMon>
        <loai_id>L07</loai_id>
        <tenLoaiMon>Khác</tenLoaiMon>
    </LoaiMon>
</LoaiMons>
